Tanggal,Judul,URL,Sentimen
15-10-2018,POLEMIK JIWASRAYA: Kementerian BUMN Turun Tangan,https://finansial.bisnis.com/read/20181015/215/849585/polemik-jiwasraya-kementerian-bumn-turun-tangan,Negatif
21-05-2021,Jiwasraya: Kasus Kami Jadi Pembelajaran Penting,https://finansial.bisnis.com/read/20210521/215/1396680/jiwasraya-kasus-kami-jadi-pembelajaran-penting,Negatif
27-02-2021,DPR Kritik Rencana KPK Lakukan Vaksinasi ke Tahanan Korupsi,https://kabar24.bisnis.com/read/20210227/15/1361751/dpr-kritik-rencana-kpk-lakukan-vaksinasi-ke-tahanan-korupsi,Negatif
14-11-2018,BPOM Temukan Kosmetik Ilegal Senilai Rp112 Miliar,https://ekonomi.bisnis.com/read/20181114/257/859976/bpom-temukan-kosmetik-ilegal-senilai-rp112-miliar,Negatif
22-04-2020,"Angkasa Pura II Pangkas Target Pendapatan Jadi Rp7,6 Triliun",https://ekonomi.bisnis.com/read/20200422/98/1231392/angkasa-pura-ii-pangkas-target-pendapatan-jadi-rp76-triliun,Negatif
12-01-2018,"TOP LOSERS 12 JANUARI: Saham Intikeramik Alamsari Industri (IKAI) Anjlok 34,64%",https://market.bisnis.com/read/20180112/7/726039/top-losers-12-januari-saham-intikeramik-alamsari-industri-ikai-anjlok-3464,Negatif
04-03-2022,"Dampak Perang Rusia Ukraina, Pemerintah Perlu Tambah Anggaran untuk Subsidi Energi dan Bansos",https://ekonomi.bisnis.com/read/20220304/9/1506906/dampak-perang-rusia-ukraina-pemerintah-perlu-tambah-anggaran-untuk-subsidi-energi-dan-bansos,Negatif
09-02-2020,"Kasus Jiwasraya, Tanda Tanya di Wisma Mulia 2",https://finansial.bisnis.com/read/20200209/215/1199180/kasus-jiwasraya-tanda-tanya-di-wisma-mulia-2,Negatif
04-12-2021,"Ancaman Varian Omicron, Ini Proyeksi Kredit 2022 BNI dan Mandiri",https://finansial.bisnis.com/read/20211204/90/1473814/ancaman-varian-omicron-ini-proyeksi-kredit-2022-bni-dan-mandiri,Negatif
19-07-2022,"Covid-19 Ngegas, Tembus 5 Ribu Kasus, Pertama Kali Sejak 24 Maret",https://kabar24.bisnis.com/read/20220719/15/1556946/covid-19-ngegas-tembus-5-ribu-kasus-pertama-kali-sejak-24-maret,Negatif
18-03-2020,"Harga Gas Turun, Kinerja Sektor Keramik Terselamatkan",https://ekonomi.bisnis.com/read/20200318/257/1215207/harga-gas-turun-kinerja-sektor-keramik-terselamatkan,Negatif
30-03-2022,"Kasus Korupsi Impor Baja, Kantor Kemenperin Digeledah!",https://kabar24.bisnis.com/read/20220330/16/1517087/kasus-korupsi-impor-baja-kantor-kemenperin-digeledah,Negatif
06-03-2021,Kendala Teknis! Pesawat Batik Air Putar Balik ke Bandara Jambi,https://ekonomi.bisnis.com/read/20210306/98/1364657/kendala-teknis-pesawat-batik-air-putar-balik-ke-bandara-jambi,Negatif
14-07-2022,"Tanpa Revisi UU Pemilu, Gugatan Presidential Threshold ke MK Akan Selalu Gagal",https://kabar24.bisnis.com/read/20220714/15/1555219/tanpa-revisi-uu-pemilu-gugatan-presidential-threshold-ke-mk-akan-selalu-gagal,Negatif
21-09-2019,"Ini 10 Saham Paling Jatuh dalam Sepekan, Termasuk HMSP dan GGRM",https://market.bisnis.com/read/20190921/7/1150960/ini-10-saham-paling-jatuh-dalam-sepekan-termasuk-hmsp-dan-ggrm,Negatif
22-07-2023,Seleksi Timnas Piala Dunia U-17: Ini Nama Pemain Diaspora yang Gagal Lolos,https://bola.bisnis.com/read/20230722/397/1677172/seleksi-timnas-piala-dunia-u-17-ini-nama-pemain-diaspora-yang-gagal-lolos,Negatif
21-01-2023,"KPK Geledah DPRD DKI, Siapa Terlibat Korupsi Tanah Pulo Gebang?",https://kabar24.bisnis.com/read/20230121/16/1620415/kpk-geledah-dprd-dki-siapa-terlibat-korupsi-tanah-pulo-gebang,Negatif
23-03-2018,Perang Dagang AS dan China Tidak Berdampak Signifikan ke RI,https://ekonomi.bisnis.com/read/20180323/12/753727/perang-dagang-as-dan-china-tidak-berdampak-signifikan-ke-ri,Negatif
12-06-2022,"Hasil F1 GP Azerbaijan: Duo Ferrari Gagal Finis, Verstappen Berjaya",https://sport.bisnis.com/read/20220612/401/1542760/hasil-f1-gp-azerbaijan-duo-ferrari-gagal-finis-verstappen-berjaya,Negatif
26-06-2022,"Gelombang PHK Landa AS, JPMorgan Pangkas Pegawai",https://ekonomi.bisnis.com/read/20220626/620/1548150/gelombang-phk-landa-as-jpmorgan-pangkas-pegawai,Negatif
09-07-2018,"Bukan Bawahan Gubernur, APIP Bisa Cegah Korupsi di Daerah",https://kabar24.bisnis.com/read/20180709/15/814620/bukan-bawahan-gubernur-apip-bisa-cegah-korupsi-di-daerah,Negatif
12-07-2021,PPKM Darurat: Penumpang Bus AKAPdi 4 Terminal Turun,https://ekonomi.bisnis.com/read/20210712/98/1416903/ppkm-darurat-penumpang-bus-akapdi-4-terminal-turun,Negatif
17-01-2019,Debat Capres 17 Januari: Prabowo Sebut Korupsi di Birokrasi karena Gaji Kurang? Ini Faktanya,https://kabar24.bisnis.com/read/20190117/15/879901/debat-capres-17-januari-prabowo-sebut-korupsi-di-birokrasi-karena-gaji-kurang-ini-faktanya-,Negatif
29-12-2022,"Perang dengan BMKG soal Badai Jabodetabek, BRIN: Prediksi Itu Tidak Resmi",https://kabar24.bisnis.com/read/20221229/15/1613377/perang-dengan-bmkg-soal-badai-jabodetabek-brin-prediksi-itu-tidak-resmi,Negatif
07-04-2021,Mensos Risma Ajak Dermawan Bantu Warga Terdampak Bencana NTT dan NTB,https://kabar24.bisnis.com/read/20210407/15/1378089/mensos-risma-ajak-dermawan-bantu-warga-terdampak-bencana-ntt-dan-ntb,Negatif
23-09-2021,Kaspersky: Transaksi Keuangan Digital Tingkatkan Ancaman Siber,https://teknologi.bisnis.com/read/20210923/84/1446146/kaspersky-transaksi-keuangan-digital-tingkatkan-ancaman-siber,Negatif
29-12-2022,"Ekonom Bank Mandiri Proyeksi Inflasi pada Akhir 2022 Capai 5,4 Persen",https://ekonomi.bisnis.com/read/20221229/9/1613331/ekonom-bank-mandiri-proyeksi-inflasi-pada-akhir-2022-capai-54-persen,Negatif
10-03-2021,"Kasus Mafia Peradilan, Eks Pejabat MA Nurhadi Divonis 6 Tahun Penjara",https://kabar24.bisnis.com/read/20210310/16/1366364/kasus-mafia-peradilan-eks-pejabat-ma-nurhadi-divonis-6-tahun-penjara,Negatif
19-06-2022,Insiden 2 Bobotoh Tewas Harus Jadi Bahan Evaluasi Panpel Persib!,https://bandung.bisnis.com/read/20220619/549/1545428/insiden-2-bobotoh-tewas-harus-jadi-bahan-evaluasi-panpel-persib,Negatif
26-03-2021,"Mudik Resmi Dilarang, Analis: Bakal Tambah Sentimen Negatif Terhadap Pasar",https://market.bisnis.com/read/20210326/7/1373203/mudik-resmi-dilarang-analis-bakal-tambah-sentimen-negatif-terhadap-pasar,Negatif
25-09-2022,China dan India Kompak Minta Putin Akhiri Perang di Ukraina,https://kabar24.bisnis.com/read/20220925/19/1581101/china-dan-india-kompak-minta-putin-akhiri-perang-di-ukraina,Negatif
16-03-2019,Ini Fakta-fakta Kecelakaan Melibatkan Boeing 737 MAX,https://ekonomi.bisnis.com/read/20190316/98/900478/ini-fakta-fakta-kecelakaan-melibatkan-boeing-737-max,Negatif
04-03-2018,"China Pangkas Ekspor Baja, Permintaan ke Krakatau Steel Melonjak",https://ekonomi.bisnis.com/read/20180304/257/745835/china-pangkas-ekspor-baja-permintaan-ke-krakatau-steel-melonjak,Negatif
18-03-2023,Dewi 'Dee' Lestari Happy Pajak Penulis Turun Jadi 6 Persen,https://lifestyle.bisnis.com/read/20230318/254/1638686/dewi-dee-lestari-happy-pajak-penulis-turun-jadi-6-persen,Negatif
17-06-2018,PIALA DUNIA 2018: Meksiko Unggul Sementara 1-0 Lawan Jerman Saat Turun Minum,https://bola.bisnis.com/read/20180617/397/807079/piala-dunia-2018-meksiko-unggul-sementara-1-0-lawan-jerman-saat-turun-minum,Negatif
19-01-2022,"Tips Hindari Aplikasi Trading Ilegal, Pemula Bisa Lakukan Hal Ini",https://market.bisnis.com/read/20220119/93/1491140/tips-hindari-aplikasi-trading-ilegal-pemula-bisa-lakukan-hal-ini,Negatif
28-04-2020,"Peringkat Utang Sejumlah Perusahaan RI Turun, Pemerintah Harus Antisipasi",https://ekonomi.bisnis.com/read/20200428/12/1234070/peringkat-utang-sejumlah-perusahaan-ri-turun-pemerintah-harus-antisipasi,Negatif
04-04-2020,"Dampak Corona, Penjualan Toyota di Amerika Utara Anjlok",https://otomotif.bisnis.com/read/20200404/275/1222554/dampak-corona-penjualan-toyota-di-amerika-utara-anjlok,Negatif
14-04-2020,Luhut Sebut Kasus Kematian Covid-19 di Indonesia Lebih Kecil dari Amerika,https://kabar24.bisnis.com/read/20200414/15/1227182/luhut-sebut-kasus-kematian-covid-19-di-indonesia-lebih-kecil-dari-amerika,Negatif
20-09-2023,"Warga Rempang Batal Direlokasi ke Pulau Galang, Bahlil Beberkan Opsi Pabrik Xinyi",https://ekonomi.bisnis.com/read/20230920/9/1697052/warga-rempang-batal-direlokasi-ke-pulau-galang-bahlil-beberkan-opsi-pabrik-xinyi,Negatif
03-05-2022,"Muncul Kasus Hepatitis Misterius di DKI, Begini Antisipasi Kemenkes",https://kabar24.bisnis.com/read/20220503/15/1529722/muncul-kasus-hepatitis-misterius-di-dki-begini-antisipasi-kemenkes,Negatif
28-07-2021,Pemerintah Gagal Tangani Pandemi Covid-19? Ini Jawaban Luhut,https://kabar24.bisnis.com/read/20210728/15/1423195/pemerintah-gagal-tangani-pandemi-covid-19-ini-jawaban-luhut,Negatif
13-10-2022,"Inflasi AS Masih Membara, Wall Street Tumbang",https://market.bisnis.com/read/20221013/7/1587426/inflasi-as-masih-membara-wall-street-tumbang,Negatif
08-02-2023,"Jokowi Pangkas 1.000 Kilometer Target Jalan Tol Beroperasi 2024, Kenapa?",https://ekonomi.bisnis.com/read/20230208/45/1626210/jokowi-pangkas-1000-kilometer-target-jalan-tol-beroperasi-2024-kenapa,Negatif
11-11-2019,Anies Bantah Pelebaran Trotoar Bikin Macet,https://jakarta.bisnis.com/read/20191111/77/1169268/anies-bantah-pelebaran-trotoar-bikin-macet,Negatif
19-01-2023,"Datangi DPR, Pengusaha Tempe Mengeluh Kedelai Mahal",https://ekonomi.bisnis.com/read/20230119/99/1619922/datangi-dpr-pengusaha-tempe-mengeluh-kedelai-mahal,Negatif
09-06-2018,Askrindo Berikan Asuransi Kecelakaan Diri Gratis Untuk 1.360 Pemudik,https://finansial.bisnis.com/read/20180609/309/804859/askrindo-berikan-asuransi-kecelakaan-diri-gratis-untuk-1.360-pemudik,Negatif
29-01-2020,Menkominfo Diminta Turun Tangan Selesaikan Konflik TVRI,https://kabar24.bisnis.com/read/20200129/15/1195215/menkominfo-diminta-turun-tangan-selesaikan-konflik-tvri,Negatif
18-02-2020,Kasus Jiwasraya Berdampak Negatif ke Fintech Reksa Dana,https://teknologi.bisnis.com/read/20200218/266/1203178/kasus-jiwasraya-berdampak-negatif-ke-fintech-reksa-dana,Negatif
02-02-2021,"Dugaan Korupsi BPJS TK, Kejagung Periksa Dirut di Dua Sekuritas",https://kabar24.bisnis.com/read/20210202/16/1351438/dugaan-korupsi-bpjs-tk-kejagung-periksa-dirut-di-dua-sekuritas,Negatif
01-08-2020,"Kanya Lakshmi, antara Sawit dan Perang Edukasi yang Belum Usai",https://ekonomi.bisnis.com/read/20200801/99/1273791/kanya-lakshmi-antara-sawit-dan-perang-edukasi-yang-belum-usai,Negatif
30-05-2023,"Direksi Baru Roatex Pastikan Uji Coba MLFF Tidak Batal, Tapi...",https://ekonomi.bisnis.com/read/20230530/45/1660822/direksi-baru-roatex-pastikan-uji-coba-mlff-tidak-batal-tapi,Negatif
19-02-2018,Airlangga Hartarto Minta Kader Golkar Terkena Korupsi Langsung Mundur,https://kabar24.bisnis.com/read/20180219/15/740478/airlangga-hartarto-minta-kader-golkar-terkena-korupsi-langsung-mundur,Negatif
30-01-2020,"Kasus Jiwasraya, Kejagung Ancam Pasal Berlapis Kepada Tersangka",https://kabar24.bisnis.com/read/20200130/16/1195709/kasus-jiwasraya-kejagung-ancam-pasal-berlapis-kepada-tersangka-,Negatif
17-09-2019,"Langganan Macet, BPTJ Usul LRT Jabodebek Diperpanjang Hingga Puncak",https://ekonomi.bisnis.com/read/20190917/98/1149564/langganan-macet-bptj-usul-lrt-jabodebek-diperpanjang-hingga-puncak,Negatif
14-01-2021,"Alokasi Dana PEN 2021 Turun dari 2020, Pemerintah Kaji Besaran Tiap Sektor",https://ekonomi.bisnis.com/read/20210114/9/1343135/alokasi-dana-pen-2021-turun-dari-2020-pemerintah-kaji-besaran-tiap-sektor,Negatif
07-01-2022,"Eks Tim Mawar Jadi Pangdam Jaya, KontraS Kecam Panglima TNI Andika Perkasa",https://kabar24.bisnis.com/read/20220107/16/1486596/eks-tim-mawar-jadi-pangdam-jaya-kontras-kecam-panglima-tni-andika-perkasa,Negatif
04-12-2018,ESDM Cabut Sanksi 2 Eksportir Bijih Mineral,https://ekonomi.bisnis.com/read/20181204/44/866370/esdm-cabut-sanksi-2-eksportir-bijih-mineral,Negatif
26-01-2022,7 Tanda Pria Jatuh Cinta dan Tergila-gila pada Anda,https://lifestyle.bisnis.com/read/20220126/54/1493851/7-tanda-pria-jatuh-cinta-dan-tergila-gila-pada-anda,Negatif
11-11-2019,"Tekan Defisit Transaksi Berjalan, Jokowi : Kalau Halangi Saya Gigit",https://ekonomi.bisnis.com/read/20191111/9/1169275/tekan-defisit-transaksi-berjalan-jokowi-kalau-halangi-saya-gigit,Negatif
06-10-2019,APM Pangkas Target Penjualan Truk,https://otomotif.bisnis.com/read/20191006/46/1156030/apm-pangkas-target-penjualan-truk,Negatif
15-09-2021,"Sanksi OJK Berakhir, Advista Life Bisa Kembali Berjualan Asuransi",https://finansial.bisnis.com/read/20210915/215/1442944/sanksi-ojk-berakhir-advista-life-bisa-kembali-berjualan-asuransi,Negatif
03-07-2022,Malaysia Sebut Inflasi Rendah Karena Gelontorkan Subsidi Jumbo,https://ekonomi.bisnis.com/read/20220703/620/1550854/malaysia-sebut-inflasi-rendah-karena-gelontorkan-subsidi-jumbo,Negatif
31-12-2020,Kontribusi Indonesia Terhadap Kasus Covid-19 Dunia Hampir Tembus 1 Persen,https://kabar24.bisnis.com/read/20201231/15/1337523/kontribusi-indonesia-terhadap-kasus-covid-19-dunia-hampir-tembus-1-persen,Negatif
28-10-2018,LIGA ITALIA: Partai Seru Lazio vs Inter Terancam Batal,https://bola.bisnis.com/read/20181028/395/854086/liga-italia-partai-seru-lazio-vs-inter-terancam-batal,Negatif
02-02-2020,"Rekening Saham Kena Blokir Terkait Jiwasraya, Analis: Bukan Penyebab Nilai Transaksi Bursa Anjlok",https://market.bisnis.com/read/20200202/7/1196429/rekening-saham-kena-blokir-terkait-jiwasraya-analis-bukan-penyebab-nilai-transaksi-bursa-anjlok,Negatif
01-05-2019,BI Sulut Sebut Harga 'Barito' Krusial dalam Inflasi Sulut,https://sulawesi.bisnis.com/read/20190501/540/917610/bi-sulut-sebut-harga-barito-krusial-dalam-inflasi-sulut,Negatif
17-07-2018,"Atasi Defisit, Ini yang Ditunggu BPJS Kesehatan",https://finansial.bisnis.com/read/20180717/215/817708/atasi-defisit-ini-yang-ditunggu-bpjs-kesehatan,Negatif
11-10-2021,5 Tips Cara Bijak Pakai PayLater Anti Rugi,https://finansial.bisnis.com/read/20211011/55/1453140/5-tips-cara-bijak-pakai-paylater-anti-rugi,Negatif
31-10-2019,"Fintech Ilegal Sulit Dibendung, Platform Dikendalikan dari Luar Negeri",https://finansial.bisnis.com/read/20191031/89/1165626/fintech-ilegal-sulit-dibendung-platform-dikendalikan-dari-luar-negeri,Negatif
18-09-2021,"Terbukti Korupsi, Pemprov DKI Pecat PNS Kota Jakarta Barat",https://jakarta.bisnis.com/read/20210918/77/1444023/terbukti-korupsi-pemprov-dki-pecat-pns-kota-jakarta-barat,Negatif
13-04-2020,"Hadapi Dampak COVID-19, Pemerintah Jaga Risiko Krisis Ekonomi",https://ekonomi.bisnis.com/read/20200413/9/1226557/hadapi-dampak-covid-19-pemerintah-jaga-risiko-krisis-ekonomi,Negatif
20-08-2019,"Ungkap Kasus Penipuan CPNS, Menteri PANRB Beri Penghargaan Polri",https://kabar24.bisnis.com/read/20190820/15/1139028/ungkap-kasus-penipuan-cpns-menteri-panrb-beri-penghargaan-polri,Negatif
29-06-2020,Negara Berpotensi Gagal Bila Penanganan Pandemi Covid-19 Tak Tepat,https://kabar24.bisnis.com/read/20200629/15/1259304/negara-berpotensi-gagal-bila-penanganan-pandemi-covid-19-tak-tepat-,Negatif
07-09-2022,"Defisit Neraca Perdagangan AS Susut Jadi US$70,65 Miliar pada Juli 2022",https://ekonomi.bisnis.com/read/20220907/620/1575237/defisit-neraca-perdagangan-as-susut-jadi-us7065-miliar-pada-juli-2022,Negatif
04-05-2018,"MotoGP Spanyol: Marc Marquez Kecelakaan, Cal Cruthclow Tercepat di Latihan 2",https://sport.bisnis.com/read/20180504/401/791811/motogp-spanyol-marc-marquez-kecelakaan-cal-cruthclow-tercepat-di-latihan-2,Negatif
13-06-2018,PIALA DUNIA 2018: Lewandowski Kian Tebar Ancaman,https://bola.bisnis.com/read/20180613/397/806182/piala-dunia-2018-lewandowski-kian-tebar-ancaman,Negatif
12-07-2023,"Penjualan Mobil Juni Turun, Lexus Kekurangan Pasokan",https://otomotif.bisnis.com/read/20230712/46/1674323/penjualan-mobil-juni-turun-lexus-kekurangan-pasokan,Negatif
13-03-2021,"Kasus Sembuh Covid-19 Bertambah 6.016 Orang, DKI Jakarta Tertinggi",https://kabar24.bisnis.com/read/20210313/15/1367194/kasus-sembuh-covid-19-bertambah-6016-orang-dki-jakarta-tertinggi,Negatif
20-09-2018,"Piala Asia U-16: Prediksi Indonesia vs Iran, Bakal Laga Sulit",https://bola.bisnis.com/read/20180920/398/840650/piala-asia-u-16-prediksi-indonesia-vs-iran-bakal-laga-sulit,Negatif
07-03-2020,"Dubes RI: Kasus Baru di China Turun, Ekonomi Mulai Bergerak",https://kabar24.bisnis.com/read/20200307/19/1210373/dubes-ri-kasus-baru-di-china-turun-ekonomi-mulai-bergerak,Negatif
25-02-2022,"Diserbu Army BTS, Aplikasi Livin Mandiri Macet. Begini Penjelasannya!",https://finansial.bisnis.com/read/20220225/90/1505036/diserbu-army-bts-aplikasi-livin-mandiri-macet-begini-penjelasannya,Negatif
01-09-2022,Mitsubishi Jual 756 Xpander di Sulsel Selama 2022,https://sulawesi.bisnis.com/read/20220901/540/1573307/mitsubishi-jual-756-xpander-di-sulsel-selama-2022,Negatif
15-08-2018,"Belajar dari Ben Mboi, Mantan Gubernur NTT yang Jatuh Cinta Pada Buku",https://lifestyle.bisnis.com/read/20180815/219/828364/belajar-dari-ben-mboi-mantan-gubernur-ntt-yang-jatuh-cinta-pada-buku,Negatif
01-08-2022,Jokowi Prediksi 800 Juta Orang Akan Kelaparan karena Krisis Pangan,https://kabar24.bisnis.com/read/20220801/15/1561824/jokowi-prediksi-800-juta-orang-akan-kelaparan-karena-krisis-pangan,Negatif
18-09-2021,Kasus Covid-19 di Jakarta Tambah 200 Orang,https://jakarta.bisnis.com/read/20210918/77/1444021/kasus-covid-19-di-jakarta-tambah-200-orang,Negatif
08-01-2022,Prediksi Roma vs Juventus: Allegri Sebut Laga Lawan Roma Selalu Sulit,https://bola.bisnis.com/read/20220108/395/1486797/prediksi-roma-vs-juventus-allegri-sebut-laga-lawan-roma-selalu-sulit,Negatif
28-05-2022,"Kasus Mafia Migor, Kejagung Selidiki Perusahaan Minyak Goreng",https://kabar24.bisnis.com/read/20220528/16/1537715/kasus-mafia-migor-kejagung-selidiki-perusahaan-minyak-goreng,Negatif
29-01-2022,Bank Jateng Gandeng KPK Atasi Kredit Macet,https://semarang.bisnis.com/read/20220129/536/1494857/bank-jateng-gandeng-kpk-atasi-kredit-macet,Negatif
13-06-2022,"Bitcoin Terus Melemah, Analis: Level US$24.000 Belum Ada Apa-apanya",https://market.bisnis.com/read/20220613/94/1543258/bitcoin-terus-melemah-analis-level-us24000-belum-ada-apa-apanya,Negatif
18-12-2020,Dino Pati Djalal: Indonesia Harus Belajar dari Krisis Yang Lalu,https://kabar24.bisnis.com/read/20201218/15/1333077/dino-pati-djalal-indonesia-harus-belajar-dari-krisis-yang-lalu,Negatif
19-01-2022,"Korupsi Taspen Life, Kejagung Periksa Tiga Saksi",https://kabar24.bisnis.com/read/20220119/16/1491119/korupsi-taspen-life-kejagung-periksa-tiga-saksi,Negatif
20-10-2021,"Tanggap Bencana, Pelindo Serahkan Bantuan Korban Gempa Bali",https://ekonomi.bisnis.com/read/20211020/98/1456439/tanggap-bencana-pelindo-serahkan-bantuan-korban-gempa-bali,Negatif
20-10-2019,Jokowi Akan Pangkas Jumlah Eselon Digantikan Ahli,https://kabar24.bisnis.com/read/20191020/15/1161228/jokowi-akan-pangkas-jumlah-eselon-digantikan-ahli,Negatif
21-11-2018,"Aksi Jual Belum Berakhir, Harga Bitcoin Ambles Dekati US$4.000",https://market.bisnis.com/read/20181121/94/862048/aksi-jual-belum-berakhir-harga-bitcoin-ambles-dekati-us4.000,Negatif
08-02-2019,Kejaksaan Negeri Jakarta Barat Tangkap Buron Korupsi Lahan PJKA,https://kabar24.bisnis.com/read/20190208/16/886878/kejaksaan-negeri-jakarta-barat-tangkap-buron-korupsi-lahan-pjka,Negatif
10-05-2022,"Wall Street Rebound di Awal Perdagangan, Investor Tunggu Data Inflasi",https://market.bisnis.com/read/20220510/7/1531827/wall-street-rebound-di-awal-perdagangan-investor-tunggu-data-inflasi,Negatif
15-04-2023,"Jelang Lebaran Harga Ayam Rendah, Peternak Minta Kemendag Turun Tangan",https://ekonomi.bisnis.com/read/20230415/12/1647273/jelang-lebaran-harga-ayam-rendah-peternak-minta-kemendag-turun-tangan,Negatif
05-06-2020,"Trafik Jalan Nasional Turun, PUPR: Preservasi Jalan Tetap Berlanjut",https://ekonomi.bisnis.com/read/20200605/45/1249197/trafik-jalan-nasional-turun-pupr-preservasi-jalan-tetap-berlanjut,Negatif
19-08-2019,"Iuran BPH Migas Turun, Harga BBM Nonsubsidi Harusnya Mengikuti",https://ekonomi.bisnis.com/read/20190819/44/1138510/iuran-bph-migas-turun-harga-bbm-nonsubsidi-harusnya-mengikuti,Negatif
21-11-2022,"Kasus Pinjol IPB, OJK Ajukan Restrukturisasi ke Perusahaan Fintech P2P Lending",https://finansial.bisnis.com/read/20221121/563/1600619/kasus-pinjol-ipb-ojk-ajukan-restrukturisasi-ke-perusahaan-fintech-p2p-lending,Negatif
25-07-2020,"Polemik Kasus Djoko Tjandra, ICW Desak DPR Gunakan Hak Angket",https://kabar24.bisnis.com/read/20200725/16/1271181/polemik-kasus-djoko-tjandra-icw-desak-dpr-gunakan-hak-angket-,Negatif
01-10-2021,"Wall Street Dibuka Hijau, AS Alami Kenaikan Inflasi Tertinggi sejak 1991",https://market.bisnis.com/read/20211001/7/1449496/wall-street-dibuka-hijau-as-alami-kenaikan-inflasi-tertinggi-sejak-1991,Negatif
06-06-2021,Pemerintah Perlu Turun Tangan Kurangi Risiko di Hulu Migas,https://ekonomi.bisnis.com/read/20210606/44/1401996/pemerintah-perlu-turun-tangan-kurangi-risiko-di-hulu-migas,Negatif
29-01-2019,"Valuasi Pasar Alibaba Turun, Ini Penyebabnya",https://kabar24.bisnis.com/read/20190129/19/883740/valuasi-pasar-alibaba-turun-ini-penyebabnya,Negatif
31-08-2021,"Anggaran Susut, Pembayaran MYC Ditjen Cipta Karya PUPR Terancam",https://ekonomi.bisnis.com/read/20210831/45/1436189/anggaran-susut-pembayaran-myc-ditjen-cipta-karya-pupr-terancam,Negatif
24-06-2021,"Sebulan Jelang Olimpiade Tokyo, Jepang Dibayangi Kenaikan Kasus Covid-19",https://kabar24.bisnis.com/read/20210624/19/1409704/sebulan-jelang-olimpiade-tokyo-jepang-dibayangi-kenaikan-kasus-covid-19,Negatif
23-07-2019,"5 Berita Populer Ekonomi, Dampak ke Klaim BPJS Usai Rumah Sakit Turun Kelas dan Polemik Laporan Keuangan GIAA Masuki Babak Baru",https://ekonomi.bisnis.com/read/20190723/12/1127900/5-berita-populer-ekonomi-dampak-ke-klaim-bpjs-usai-rumah-sakit-turun-kelas-dan-polemik-laporan-keuangan-giaa-masuki-babak-baru,Negatif
23-10-2021,BFIN: Portofolio Restrukturisasi Pembiayaan Turun Lebih dari Separuh,https://finansial.bisnis.com/read/20211023/89/1457421/bfin-portofolio-restrukturisasi-pembiayaan-turun-lebih-dari-separuh,Negatif
06-02-2023,"Usai PHK Massal, Dell Ganti Presiden di Asia Pasifik dan Jepang",https://teknologi.bisnis.com/read/20230206/84/1625362/usai-phk-massal-dell-ganti-presiden-di-asia-pasifik-dan-jepang,Negatif
25-11-2020,Satgas Covid-19 Tugaskan Divisi Gakkum Guna Tentukan Sanksi Kerumunan Massa FPI,https://kabar24.bisnis.com/read/20201125/15/1322657/satgas-covid-19-tugaskan-divisi-gakkum-guna-tentukan-sanksi-kerumunan-massa-fpi,Negatif
15-03-2018,"LAGA UJI COBA : Lawan Persela Batal, Persis Ditantang Persijap",https://www.bisnis.com/read/20180315/499/903224/laga-uji-coba-lawan-persela-batal-persis-ditantang-persijap,Negatif
02-12-2019,"Inflasi DKI Jakarta November 2019 Capai 0,19 Persen",https://jakarta.bisnis.com/read/20191202/77/1176937/inflasi-dki-jakarta-november-2019-capai-019-persen,Negatif
11-08-2019,Setya Novanto Jadi Saksi Sofyan Basir di Kasus PLTU Riau-1 Besok,https://kabar24.bisnis.com/read/20190811/16/1135137/setya-novanto-jadi-saksi-sofyan-basir-di-kasus-pltu-riau-1-besok,Negatif
21-03-2023,PPATK: Transaksi Mencurigakan Rp349 T Bukan Korupsi di Kemenkeu,https://ekonomi.bisnis.com/read/20230321/9/1639583/ppatk-transaksi-mencurigakan-rp349-t-bukan-korupsi-di-kemenkeu,Negatif
12-04-2022,Berikut Kendala Uji Klinik Vaksin Covid-19 Merah Putih,https://kabar24.bisnis.com/read/20220412/15/1522352/berikut-kendala-uji-klinik-vaksin-covid-19-merah-putih,Negatif
23-04-2020,"Larangan Mudik, Pelni Setop Jual Tiket ke Penumpang",https://ekonomi.bisnis.com/read/20200423/98/1232001/larangan-mudik-pelni-setop-jual-tiket-ke-penumpang,Negatif
06-06-2021,"Rossi dan Marquez Jatuh, Oliveira Sabet Juara GP Catalunya",https://sport.bisnis.com/read/20210606/401/1401977/rossi-dan-marquez-jatuh-oliveira-sabet-juara-gp-catalunya,Negatif
12-08-2021,"Likuiditas Masih Longgar, BRI Akan Pangkas Bunga Pinjaman 25 bps",https://finansial.bisnis.com/read/20210812/90/1429202/likuiditas-masih-longgar-bri-akan-pangkas-bunga-pinjaman-25-bps,Negatif
22-12-2020,"Kasus Dialihkan ke Kejagung, Asabri Masih Belum Publikasikan Laporan Keuangan",https://finansial.bisnis.com/read/20201222/215/1334387/kasus-dialihkan-ke-kejagung-asabri-masih-belum-publikasikan-laporan-keuangan,Negatif
17-01-2022,Habiburokhman: Kasus Pembuangan Sesajen Tak Perlu Sampai ke Persidangan,https://kabar24.bisnis.com/read/20220117/16/1490034/habiburokhman-kasus-pembuangan-sesajen-tak-perlu-sampai-ke-persidangan,Negatif
08-03-2023,Rangkuman Perang Rusia vs Ukraina: Bakhmut Bisa Jatuh ke Tangan Rusia,https://kabar24.bisnis.com/read/20230308/19/1635444/rangkuman-perang-rusia-vs-ukraina-bakhmut-bisa-jatuh-ke-tangan-rusia,Negatif
04-05-2020,AAUI: Kinerja Asuransi Kendaraan Masih akan Stagnan,https://finansial.bisnis.com/read/20200504/215/1236397/aaui-kinerja-asuransi-kendaraan-masih-akan-stagnan,Negatif
05-04-2021,"IPC Bangun Akses Baru, Urai Macet Tanjung Priok",https://ekonomi.bisnis.com/read/20210405/98/1376993/ipc-bangun-akses-baru-urai-macet-tanjung-priok,Negatif
24-12-2021,"Update Covid-19 DKI 24 Desember 2021: Kasus Baru 69 Orang, 29 Sembuh",https://kabar24.bisnis.com/read/20211224/15/1481607/update-covid-19-dki-24-desember-2021-kasus-baru-69-orang-29-sembuh,Negatif
01-11-2022,Nilai Ekspor Sumbar Turun pada September 2022,https://sumatra.bisnis.com/read/20221101/534/1593780/nilai-ekspor-sumbar-turun-pada-september-2022,Negatif
07-05-2018,"HAK JUAL PRODUK: Nestle Bayar Starbucks US$7,1 Miliar Tunai",https://kabar24.bisnis.com/read/20180507/19/792738/hak-jual-produk-nestle-bayar-starbucks-us71-miliar-tunai,Negatif
02-01-2019,"Jual Saham Entitas Anak, Bekasi Fajar (BEST) Kantongi Rp80,6 Miliar",https://market.bisnis.com/read/20190102/192/874849/jual-saham-entitas-anak-bekasi-fajar-best-kantongi-rp806-miliar,Negatif
26-11-2022,"Survei BI: Inflasi Pekan Keempat November 2022 Capai 0,18 Persen",https://ekonomi.bisnis.com/read/20221126/9/1602481/survei-bi-inflasi-pekan-keempat-november-2022-capai-018-persen,Negatif
23-02-2022,"Kasus Dugaan Korupsi, Kejagung Cecar 3 Petinggi Garuda Indonesia",https://kabar24.bisnis.com/read/20220223/16/1504102/kasus-dugaan-korupsi-kejagung-cecar-3-petinggi-garuda-indonesia,Negatif
