Tanggal,Judul,URL,Sentimen
12-08-2021,"Syarat Naik Pesawat Garuda, Lion Air, Air Asia, dan Citilink di Masa PPKM Level",https://lifestyle.bisnis.com/read/20210812/361/1429091/syarat-naik-pesawat-garuda-lion-air-air-asia-dan-citilink-di-masa-ppkm-level,Positif
22-09-2022,"Suku Bunga Naik, Harga Spare Part Otomotif Bakal Ikut Meningkat?",https://ekonomi.bisnis.com/read/20220922/257/1580406/suku-bunga-naik-harga-spare-part-otomotif-bakal-ikut-meningkat,Positif
21-11-2018,Honda Dukung Penuh 2XU Compression Run Indonesia 2018,https://bola.bisnis.com/read/20181121/60/862059/honda-dukung-penuh-2xu-compression-run-indonesia-2018,Positif
12-07-2019,"Beli SBR007, Berapa Keuntungan per Bulan Bisa Diperoleh?",https://finansial.bisnis.com/read/20190712/55/1123706/beli-sbr007-berapa-keuntungan-per-bulan-bisa-diperoleh,Positif
11-11-2021,Intip Efek Berganda Investasi Telkom ke Gojek,https://teknologi.bisnis.com/read/20211111/101/1465095/intip-efek-berganda-investasi-telkom-ke-gojek,Positif
29-06-2018,"Suku Bunga Naik, Pemerintah Harus Ambil Langkah Strategis",https://finansial.bisnis.com/read/20180629/11/811212/suku-bunga-naik-pemerintah-harus-ambil-langkah-strategis,Positif
17-11-2022,"Bank Bisa Investasi di Fintech, Asosiasi Pinjol Dorong Penyertaan di Credit Scoring",https://finansial.bisnis.com/read/20221117/563/1599464/bank-bisa-investasi-di-fintech-asosiasi-pinjol-dorong-penyertaan-di-credit-scoring,Positif
12-08-2020,"Dicecar Warganet, Zulkifli Hasan Ungkap Alasannya Dukung Gibran",https://kabar24.bisnis.com/read/20200812/15/1278524/dicecar-warganet-zulkifli-hasan-ungkap-alasannya-dukung-gibran,Positif
05-07-2019,Harga Daging Ayam di DIY Berangsur Naik,https://ekonomi.bisnis.com/read/20190705/99/1120781/harga-daging-ayam-di-diy-berangsur-naik,Positif
18-01-2021,"Marak Investor Saham Beli Pakai Utang, Pengamat: Dimanfaatkan Juru Pompom",https://market.bisnis.com/read/20210118/7/1344608/marak-investor-saham-beli-pakai-utang-pengamat-dimanfaatkan-juru-pompom,Positif
03-11-2021,"Rekomendasi Hold Saham HMSP, GGRM dan WIIM Sekalipun Pendapatan Naik",https://market.bisnis.com/read/20211103/189/1461851/rekomendasi-hold-saham-hmsp-ggrm-dan-wiim-sekalipun-pendapatan-naik,Positif
13-11-2021,"Harga Properti di Hong Kong Terus Naik, The Peak Bikin Rekor Baru",https://ekonomi.bisnis.com/read/20211113/47/1465647/harga-properti-di-hong-kong-terus-naik-the-peak-bikin-rekor-baru,Positif
12-04-2021,Disperindagkop UKM Kaltim Tinjau Potensi Ekspor Nonmigas,https://kalimantan.bisnis.com/read/20210412/408/1380033/disperindagkop-ukm-kaltim-tinjau-potensi-ekspor-nonmigas,Positif
03-08-2020,"Didukung Layanan Digital, Porsi Dana Murah Bank Maybank Naik Jadi 40 Persen",https://finansial.bisnis.com/read/20200803/90/1274544/didukung-layanan-digital-porsi-dana-murah-bank-maybank-naik-jadi-40-persen,Positif
01-05-2023,"Penjualan Nikel Moncer, Laba Bersih PAM Mineral (NICL) Terbang 135 Persen",https://market.bisnis.com/read/20230501/192/1651719/penjualan-nikel-moncer-laba-bersih-pam-mineral-nicl-terbang-135-persen,Positif
11-06-2020,"Tertarik Beli ORI017, Ini Cara Pemesanannya!",https://market.bisnis.com/read/20200611/92/1251674/tertarik-beli-ori017-ini-cara-pemesanannya,Positif
24-02-2019,"11 Tahun Beroperasi, Aetra Klaim Kucurkan Investasi Rp2,5 Triliun",https://jakarta.bisnis.com/read/20190224/77/892769/11-tahun-beroperasi-aetra-klaim-kucurkan-investasi-rp25-triliun,Positif
07-10-2020,Dua Rute Kargo Baru Garuda Dukung Ekspor Indonesia Timur,https://sulawesi.bisnis.com/read/20201007/540/1302216/dua-rute-kargo-baru-garuda-dukung-ekspor-indonesia-timur,Positif
02-09-2022,"Saham ADRO Hijau Usai Laba Tembus Rekor, Cek Rekomendasi Sahamnya",https://market.bisnis.com/read/20220902/189/1573655/saham-adro-hijau-usai-laba-tembus-rekor-cek-rekomendasi-sahamnya,Positif
04-08-2023,"Bank Milik Konglomerat Sampoerna Raih Laba Bersih Rp27,11 Miliar",https://finansial.bisnis.com/read/20230804/90/1681557/bank-milik-konglomerat-sampoerna-raih-laba-bersih-rp2711-miliar,Positif
23-12-2021,"Kinerja Startup Cemerlang, MDI Bidik 10 Perusahaan Tahun Depan",https://teknologi.bisnis.com/read/20211223/266/1481265/kinerja-startup-cemerlang-mdi-bidik-10-perusahaan-tahun-depan,Positif
17-03-2022,Meneropong Prospek Adhi Karya (ADHI) Usai Rights Issue,https://market.bisnis.com/read/20220317/192/1512083/meneropong-prospek-adhi-karya-adhi-usai-rights-issue,Positif
10-07-2020,Petrokimia Gresik Cetak Rekor Ekspor Saat Pandemi,https://ekonomi.bisnis.com/read/20200710/257/1264459/petrokimia-gresik-cetak-rekor-ekspor-saat-pandemi,Positif
25-08-2023,Pertemuan Menkes Asean Bahas Pencegahan Potensi Pandemi,https://kabar24.bisnis.com/read/20230825/15/1688461/pertemuan-menkes-asean-bahas-pencegahan-potensi-pandemi,Positif
09-02-2020,Tren Positif Pasar Perkantoran Terdorong Keterbatasan Pasokan,https://ekonomi.bisnis.com/read/20200209/47/1199178/tren-positif-pasar-perkantoran-terdorong-keterbatasan-pasokan,Positif
04-05-2023,"Laba Bank Sumut Capai Rp204,37 Miliar pada Kuartal I/2023",https://finansial.bisnis.com/read/20230504/90/1652638/laba-bank-sumut-capai-rp20437-miliar-pada-kuartal-i2023,Positif
28-02-2022,"Punya Potensi Besar, Wapres: Keuangan Syariah Harus Dioptimalkan!",https://ekonomi.bisnis.com/read/20220228/9/1505615/punya-potensi-besar-wapres-keuangan-syariah-harus-dioptimalkan,Positif
20-12-2019,"IHSG Menguat di Akhir Pekan, Investor Asing Borong Saham Rp2 Triliun Lebih",https://market.bisnis.com/read/20191220/7/1183441/ihsg-menguat-di-akhir-pekan-investor-asing-borong-saham-rp2-triliun-lebih,Positif
13-06-2022,Rekor! Surat Utang Terbitan Leasing Tembus Capaian Sebelum Pandemi,https://finansial.bisnis.com/read/20220613/89/1543186/rekor-surat-utang-terbitan-leasing-tembus-capaian-sebelum-pandemi,Positif
26-02-2020,Future Pipe Investasi US$40 Juta,https://ekonomi.bisnis.com/read/20200226/257/1206400/future-pipe-investasi-us40-juta,Positif
05-07-2023,Awas! Penawaran Investasi Atas Nama OJK di Telegram Ternyata Hoax!,https://finansial.bisnis.com/read/20230705/90/1672084/awas-penawaran-investasi-atas-nama-ojk-di-telegram-ternyata-hoax,Positif
06-07-2019,Kemenpar Dukung ASDP Perluas Konektivitas di Destinasi Wisata,https://lifestyle.bisnis.com/read/20190706/224/1120930/kemenpar-dukung-asdpperluas-konektivitas-di-destinasi-wisata,Positif
03-10-2021,Mau Bepergian Naik Bus Antarkota? Simak 4 Tips Ini agar Terhindar dari Calo Tiket,https://lifestyle.bisnis.com/read/20211003/361/1449864/mau-bepergian-naik-bus-antarkota-simak-4-tips-ini-agar-terhindar-dari-calo-tiket,Positif
25-08-2020,Harga Tandan Buah Segar Sawit Naik Tipis,https://sumatra.bisnis.com/read/20200825/534/1283105/harga-tandan-buah-segar-sawit-naik-tipis,Positif
28-05-2021,"Hasil RUPST 2020 Sawit Sumbermas (SSMS): Dividen Rp290,4 Miliar, Siap Obligasi Rp2,5 Triliun",https://market.bisnis.com/read/20210528/192/1399014/hasil-rupst-2020-sawit-sumbermas-ssms-dividen-rp2904-miliar-siap-obligasi-rp25-triliun,Positif
11-04-2021,"Reksa Dana Syariah Jadi Pilihan Investasi, Apa Saja Sih Kelebihannya?",https://finansial.bisnis.com/read/20210411/231/1379544/reksa-dana-syariah-jadi-pilihan-investasi-apa-saja-sih-kelebihannya,Positif
21-02-2021,"Efisiensi Transportasi dan Trucking, INSA Dorong Sistem Booking Online",https://ekonomi.bisnis.com/read/20210221/98/1358970/efisiensi-transportasi-dan-trucking-insa-dorong-sistem-booking-online,Positif
24-02-2019,Suplai Bahan Baku Dorong Utilisasi Industri Pengolahan Ikan,https://ekonomi.bisnis.com/read/20190224/257/892816/suplai-bahan-baku-dorong-utilisasi-industri-pengolahan-ikan,Positif
08-06-2023,"Bank Milik Wings Group (MASB) Absen Bagikan Dividen, Laba untuk Perkuat Modal",https://finansial.bisnis.com/read/20230608/90/1663700/bank-milik-wings-group-masb-absen-bagikan-dividen-laba-untuk-perkuat-modal,Positif
26-04-2021,Jurus DP Tinggi di Era Pandemi Bikin Aset CNAF Naik 13 Persen,https://finansial.bisnis.com/read/20210426/89/1386645/jurus-dp-tinggi-di-era-pandemi-bikin-aset-cnaf-naik-13-persen,Positif
12-09-2019,Kebutuhan Truk Berdaya Besar Bakal Meningkat,https://otomotif.bisnis.com/read/20190912/275/1147892/kebutuhan-truk-berdaya-besar-bakal-meningkat,Positif
10-08-2022,"Tarif Ojek Online di Jakarta Naik Mulai 14 Agustus, Ini Imbauan Wagub DKI",https://jakarta.bisnis.com/read/20220810/77/1565367/tarif-ojek-online-di-jakarta-naik-mulai-14-agustus-ini-imbauan-wagub-dki,Positif
06-12-2022,"Kredit Perbankan Oktober 2022 Naik Rp58,61 Triliun",https://finansial.bisnis.com/read/20221206/90/1605771/kredit-perbankan-oktober-2022-naik-rp5861-triliun,Positif
03-05-2020,Semua Pasien Positif Covid-19 di Tana Toraja Telah Sembuh,https://sulawesi.bisnis.com/read/20200503/539/1235812/semua-pasien-positif-covid-19-di-tana-toraja-telah-sembuh,Positif
04-06-2023,PLN Sukses Pasok Listrik Tanpa Kedip dalam Gelaran Formula E 2023,https://ekonomi.bisnis.com/read/20230604/44/1662012/pln-sukses-pasok-listrik-tanpa-kedip-dalam-gelaran-formula-e-2023,Positif
28-05-2020,"Januari - April, Pembiayaan Multiguna Mandiri Tunas Finance Tumbuh 21 Persen",https://finansial.bisnis.com/read/20200528/89/1245999/januari-april-pembiayaan-multiguna-mandiri-tunas-finance-tumbuh-21-persen,Positif
08-03-2018,"Indosurya Sekuritas: Data Ritel Bakal Positif Bagi IHSG, Simak Rekomendasi Sahamnya",https://market.bisnis.com/read/20180308/189/747890/indosurya-sekuritas-data-ritel-bakal-positif-bagi-ihsg-simak-rekomendasi-sahamnya,Positif
03-09-2022,Harga BBM Naik! Ini Deretan Dampaknya: Lonjakan Harga Pangan hingga PHK,https://ekonomi.bisnis.com/read/20220903/9/1573817/harga-bbm-naik-ini-deretan-dampaknya-lonjakan-harga-pangan-hingga-phk,Positif
11-02-2018,Fluktuasi Pasar Obligasi Jadi Momentum Beli Tenor Panjang,https://market.bisnis.com/read/20180211/92/737458/fluktuasi-pasar-obligasi-jadi-momentum-beli-tenor-panjang,Positif
23-10-2022,Nasdem Mengaku Dorong Anies Bertemu Habib Rizieq Shihab,https://kabar24.bisnis.com/read/20221023/15/1590498/nasdem-mengaku-dorong-anies-bertemu-habib-rizieq-shihab,Positif
01-12-2022,"Nilai Ekspor Asal Sumbar Oktober 2022 Naik 40,08 Persen",https://sumatra.bisnis.com/read/20221201/534/1604275/nilai-ekspor-asal-sumbar-oktober-2022-naik-4008-persen,Positif
29-09-2019,"Penyaluran Kredit di Wilayah Kerja OJK Malang Tumbuh 11,10 Persen",https://surabaya.bisnis.com/read/20190929/532/1153480/penyaluran-kredit-di-wilayah-kerja-ojk-malang-tumbuh-1110-persen,Positif
07-05-2021,"Jangan Asal Pilih, Ini Produk Skin Care Aman untuk Si Kecil",https://lifestyle.bisnis.com/read/20210507/236/1391938/jangan-asal-pilih-ini-produk-skin-care-aman-untuk-si-kecil,Positif
04-02-2019,Tiga Faktor Penyebab Sukses Tidaknya Tol Laut,https://surabaya.bisnis.com/read/20190204/532/885427/tiga-faktor-penyebab-sukses-tidaknya-tol-laut,Positif
09-03-2020,Pemerintah: Kompetensi SDM Perbankan Harus Naik Kelas,https://finansial.bisnis.com/read/20200309/90/1211143/pemerintah-kompetensi-sdm-perbankan-naik-kelas,Positif
28-10-2018,"Menilik Prospek BBRI, Ini Catatan Riset & Rekomendasi Analis",https://market.bisnis.com/read/20181028/7/854087/menilik-prospek-bbri-ini-catatan-riset-rekomendasi-analis,Positif
01-09-2019,Transaksi Modal dan Finansial Masih Berpotensi Sumbang Surplus Neraca Pembayaran Indonesia,https://ekonomi.bisnis.com/read/20190901/9/1143322/transaksi-modal-dan-finansial-masih-berpotensi-sumbang-surplus-neraca-pembayaran-indonesia,Positif
26-08-2020,Komite Penanganan Covid-19 dan PEN Dorong Perubahan Perpres 82/2020,https://ekonomi.bisnis.com/read/20200826/9/1283605/komite-penanganan-covid-19-dan-pen-dorong-perubahan-perpres-822020,Positif
04-07-2019,BI Malang Dorong Kopi Daerah Tembus Ekspor,https://surabaya.bisnis.com/read/20190704/532/1120289/bi-malang-dorong-kopi-daerah-tembus-ekspor,Positif
28-06-2021,Kadin Tegaskan Manipulasi Realisasi Investasi Tak Berdampak ke Penyerapan Naker,https://ekonomi.bisnis.com/read/20210628/12/1410997/kadin-tegaskan-manipulasi-realisasi-investasi-tak-berdampak-ke-penyerapan-naker,Positif
28-07-2020,"Penjualan Menurun, Laba Merck (MERK) Mampu Melesat 424 Persen",https://market.bisnis.com/read/20200728/192/1272363/penjualan-menurun-laba-merck-merk-mampu-melesat-424-persen,Positif
14-06-2023,Permintaan Hewan Kurban di Palembang Mulai Meningkat,https://sumatra.bisnis.com/read/20230614/534/1665586/permintaan-hewan-kurban-di-palembang-mulai-meningkat,Positif
04-05-2021,Sinar Mas Land Bidik Potensi Pembelian Properti Gunakan THR,https://ekonomi.bisnis.com/read/20210504/47/1390403/sinar-mas-land-bidik-potensi-pembelian-properti-gunakan-thr,Positif
07-02-2022,"Investasi Dorong Pertumbuhan, Ini Kinerja Kementerian Bahlil",https://premium.bisnis.com/read/20220207/658/1857091/investasi-dorong-pertumbuhan-ini-kinerja-kementerian-bahlil,Positif
24-08-2018,Teknologi ABB Dukung Asian Games 2018,https://kabar24.bisnis.com/read/20180824/15/831327/teknologi-abb-dukung-asian-games-2018,Positif
21-03-2018,"Impor Mobil CBU Naik Terus, Ini Penyebabnya",https://otomotif.bisnis.com/read/20180321/275/752847/impor-mobil-cbu-naik-terus-ini-penyebabnya,Positif
21-08-2023,"Bukalapak (BUKA) Tetap Fokus Tumbuh Berkelanjutan, Kurangi Bakar Uang",https://teknologi.bisnis.com/read/20230821/266/1686837/bukalapak-buka-tetap-fokus-tumbuh-berkelanjutan-kurangi-bakar-uang,Positif
18-09-2019,MUI Usul RKUHP Dorong Hukuman Mati dan Perluas Cakupan Zina,https://kabar24.bisnis.com/read/20190918/15/1150021/mui-usul-rkuhp-dorong-hukuman-mati-dan-perluas-cakupan-zina,Positif
12-01-2020,"Hasil Basket NBA : Tatum Cemerlang, Celtics Gasak Pelicans",https://bola.bisnis.com/read/20200112/60/1189321/hasil-basket-nba-tatum-cemerlang-celtics-gasak-pelicans,Positif
19-10-2023,McKinsey: Penduduk Kelas Menengah di Asean Naik Dua Kali Lipat 2030,https://ekonomi.bisnis.com/read/20231019/9/1706052/mckinsey-penduduk-kelas-menengah-di-asean-naik-dua-kali-lipat-2030,Positif
06-04-2020,Positif Covid 19 di Kota Malang Bertambah 3 Orang dalam Sehari,https://surabaya.bisnis.com/read/20200406/531/1223416/positif-covid-19-di-kota-malang-bertambah-3-orang-dalam-sehari,Positif
08-12-2020,Bidik Peluang Ekspansi UMKM ke Australia di Masa Pandemi,https://entrepreneur.bisnis.com/read/20201208/263/1328287/bidik-peluang-ekspansi-umkm-ke-australia-di-masa-pandemi,Positif
29-03-2022,"Bank DKI Dukung Galeri JakPreneur, Dorong Pemberdayaan UMKM",https://jakarta.bisnis.com/read/20220329/77/1516599/bank-dki-dukung-galeri-jakpreneur-dorong-pemberdayaan-umkm,Positif
08-04-2022,"Setelah PPN Naik, Beranikah Sri Mulyani Pajaki E-commerce?",https://ekonomi.bisnis.com/read/20220408/259/1520837/setelah-ppn-naik-beranikah-sri-mulyani-pajaki-e-commerce,Positif
07-09-2023,Direktur SWF Indonesia Beberkan Cara Melihat Risiko Saat Mengincar Investasi,https://finansial.bisnis.com/read/20230907/55/1692339/direktur-swf-indonesia-beberkan-cara-melihat-risiko-saat-mengincar-investasi,Positif
06-10-2022,"Kuota Ditambah, Stok BBM Subsidi Riau Aman Sampai Akhir 2022",https://sumatra.bisnis.com/read/20221006/534/1585065/kuota-ditambah-stok-bbm-subsidi-riau-aman-sampai-akhir-2022,Positif
22-10-2019,Pemprov Dorong Kinerja ASN Papua jadi Pionir untuk Indonesia Timur,https://papua.bisnis.com/read/20191022/414/1162236/pemprov-dorong-kinerja-asn-papua-jadi-pionir-untuk-indonesia-timur,Positif
24-09-2018,"FOMC Digelar Pekan Ini, Suku Bunga Acuan The Fed Diprediksi Naik 25 Bps",https://ekonomi.bisnis.com/read/20180924/9/841730/fomc-digelar-pekan-ini-suku-bunga-acuan-the-fed-diprediksi-naik-25-bps,Positif
20-08-2020,"Survei IPI: 36,8 Persen Elite Anggap Pemerintah Sukses Atasi Covid-19",https://kabar24.bisnis.com/read/20200820/15/1281430/survei-ipi-368-persen-elite-anggap-pemerintah-sukses-atasi-covid-19,Positif
08-02-2019,"Hasil Basket NBA: Pacers Lanjutkan Momentum Positif, Gasak Clippers",https://bola.bisnis.com/read/20190208/60/886905/hasil-basket-nba-pacers-lanjutkan-momentum-positif-gasak-clippers,Positif
21-05-2018,Ekonomi DI Yogyakarta Pada Triwulan II/2018 Diperkirakan Naik,https://semarang.bisnis.com/read/20180521/535/797917/ekonomi-di-yogyakarta-pada-triwulan-ii2018-diperkirakan-naik,Positif
10-08-2022,"Airlangga : Total Investasi Toyota di Indonesia Rp63,9 Triliun",https://otomotif.bisnis.com/read/20220810/46/1565435/airlangga-total-investasi-toyota-di-indonesia-rp639-triliun,Positif
12-02-2022,"Waduh! Harga Kedelai Naik, Budidaya Bisa Jadi Solusi",https://ekonomi.bisnis.com/read/20220212/99/1499683/waduh-harga-kedelai-naik-budidaya-bisa-jadi-solusi,Positif
08-04-2020,"Berbalik Untung, Gunawan Dianjaya Steel (GDST) Cetak Laba Rp26,81 Miliar",https://market.bisnis.com/read/20200408/192/1224670/berbalik-untung-gunawan-dianjaya-steel-gdst-cetak-laba-rp2681-miliar,Positif
12-02-2021,Beli Mobil Suzuki Berhadiah Iphone & Emas? Cek Promo Februari,https://otomotif.bisnis.com/read/20210212/275/1355632/beli-mobil-suzuki-berhadiah-iphone-emas-cek-promo-februari,Positif
17-07-2018,CPPIB dan Longfor Group Kerjasama Investasi Perumahan di China,https://ekonomi.bisnis.com/read/20180717/48/817682/cppib-dan-longfor-group-kerjasama-investasi-perumahan-di-china,Positif
14-09-2019,Perusahaan Rokok Kecil Usulkan Tarif Cukai SKT Golongan 3 Tidak Naik,https://ekonomi.bisnis.com/read/20190914/9/1148403/perusahaan-rokok-kecil-usulkan-tarif-cukai-skt-golongan-3-tidak-naik,Positif
09-02-2021,Pengguna Sumut Mobile Meningkat 50 Persen Selama Pandemi,https://sumatra.bisnis.com/read/20210209/534/1354509/pengguna-sumut-mobile-meningkat-50-persen-selama-pandemi,Positif
02-09-2018,Simak Kunci Sukses Proses Restrukturisasi Perhutani,https://finansial.bisnis.com/read/20180902/309/834248/simak-kunci-sukses-proses-restrukturisasi-perhutani,Positif
20-09-2020,Intiland (DILD) Sebut Daya Beli Meningkat Bila Pajak Properti Diturunkan,https://market.bisnis.com/read/20200920/192/1294158/intiland-dild-sebut-daya-beli-meningkat-bila-pajak-properti-diturunkan,Positif
17-02-2022,"PIP Salurkan Pembiayaan, Pelaku Usaha Ultra Mikro Terus Meningkat",https://ekonomi.bisnis.com/read/20220217/9/1501751/pip-salurkan-pembiayaan-pelaku-usaha-ultra-mikro-terus-meningkat,Positif
28-05-2023,3 Penyebab Harga Telur Ayam di Bandung Naik Jadi Rp32 Ribu Per Kilogram,https://bandung.bisnis.com/read/20230528/550/1660054/3-penyebab-harga-telur-ayam-di-bandung-naik-jadi-rp32-ribu-per-kilogram,Positif
01-06-2019,"Jika di Solo, Jangan Lupa Beli Oleh-oleh Batik di Pasar Klewer",https://kabar24.bisnis.com/read/20190601/15/929936/jika-di-solo-jangan-lupa-beli-oleh-oleh-batik-di-pasar-klewer,Positif
01-10-2020,Intiland Geber Promo Hingga Akhir Tahun,https://ekonomi.bisnis.com/read/20201001/47/1299536/intiland-geber-promo-hingga-akhir-tahun,Positif
29-07-2019,Pemprov Sumut Dukung Pembentukan Holding Kawasan,https://sumatra.bisnis.com/read/20190729/533/1130162/pemprov-sumut-dukung-pembentukan-holding-kawasan,Positif
22-10-2023,"Cum Dividen AVIA Senin (23/10), Emiten Konglomerat Hermanto Tanoko Tebar Ratusan Miliar",https://market.bisnis.com/read/20231022/7/1706697/cum-dividen-avia-senin-2310-emiten-konglomerat-hermanto-tanoko-tebar-ratusan-miliar,Positif
09-06-2019,"Investasi Pabrik Polyethylene US$380 Juta, Chandra Asri (TPIA) Dapat Tax Holiday",https://market.bisnis.com/read/20190609/192/932110/investasi-pabrik-polyethylene-us380-juta-chandra-asri-tpia-dapat-tax-holiday,Positif
15-09-2022,"Sri Mulyani Sebut Target Pajak 2023 Moderat, Padahal Naik Pesat secara Tahunan",https://ekonomi.bisnis.com/read/20220915/259/1578085/sri-mulyani-sebut-target-pajak-2023-moderat-padahal-naik-pesat-secara-tahunan,Positif
16-04-2020,"Positif Corona di Lampung Bertambah 5 Pasien, 3 Orang tanpa Gejala",https://kabar24.bisnis.com/read/20200416/15/1228451/positif-corona-di-lampung-bertambah-5-pasien-3-orang-tanpa-gejala,Positif
09-08-2020,INACA Minta Pemda Dukung Maskapai Soal Safe Travel Campaign,https://ekonomi.bisnis.com/read/20200809/98/1276941/inaca-minta-pemda-dukung-maskapai-soal-safe-travel-campaign,Positif
08-06-2018,MUDIK LEBARAN 2018: Pelabuhan Merak Terpantau Lancar,https://ekonomi.bisnis.com/read/20180608/98/804721/mudik-lebaran-2018-pelabuhan-merak-terpantau-lancar,Positif
14-06-2022,Olike Rilis Promo Diskon Hingga 55 Persen di PRJ,https://teknologi.bisnis.com/read/20220614/266/1543778/olike-rilis-promo-diskon-hingga-55-persen-di-prj,Positif
16-02-2023,"PTPN Dekati Dua Perusahaan Korsel, Jajaki Potensi IPO PalmCo",https://market.bisnis.com/read/20230216/192/1628991/ptpn-dekati-dua-perusahaan-korsel-jajaki-potensi-ipo-palmco,Positif
02-05-2023,"Laba Bersih Pengendali Kimia Farma (KAEF) Longsor, Kok yang Non-Pengendali Naik?",https://market.bisnis.com/read/20230502/192/1652059/laba-bersih-pengendali-kimia-farma-kaef-longsor-kok-yang-non-pengendali-naik,Positif
18-05-2023,"Fokus Dongkrak CASA, Transaksi Digital Maybank Indonesia (BNII) Tumbuh Pesat",https://finansial.bisnis.com/read/20230518/90/1657163/fokus-dongkrak-casa-transaksi-digital-maybank-indonesia-bnii-tumbuh-pesat,Positif
01-01-2022,Pengunjung Candi Borobudur Meningkat di Akhir 2021,https://semarang.bisnis.com/read/20220101/535/1484309/pengunjung-candi-borobudur-meningkat-di-akhir-2021,Positif
05-10-2020,"Max Verstappen lagi Naik Daun, Honda Mundur dari F1 Akhir 2021",https://otomotif.bisnis.com/read/20201005/275/1300917/max-verstappen-lagi-naik-daun-honda-mundur-dari-f1-akhir-2021,Positif
12-06-2021,"Adhi Commuter Pede Prospek Properti di Timur Jakarta Mulai Pulih, Ini Alasannya",https://ekonomi.bisnis.com/read/20210612/47/1404663/adhi-commuter-pede-prospek-properti-di-timur-jakarta-mulai-pulih-ini-alasannya,Positif
16-01-2023,"IHSG Menguat, SMGR hingga TLKM Jadi Buruan Investor Asing",https://market.bisnis.com/read/20230116/7/1618725/ihsg-menguat-smgr-hingga-tlkm-jadi-buruan-investor-asing,Positif
27-08-2022,Danpussenarhanud Pastikan Dukung Keamanan Pupuk Kaltim dari Potensi Ancaman dan Gangguan,https://kalimantan.bisnis.com/read/20220827/407/1571348/danpussenarhanud-pastikan-dukung-keamanan-pupuk-kaltim-dari-potensi-ancaman-dan-gangguan,Positif
22-08-2019,"Bea Balik Nama Mobil dan Motor Baru di DKI Jakarta Resmi Naik 2,5 Persen",https://jakarta.bisnis.com/read/20190822/77/1140032/bea-balik-nama-mobil-dan-motor-baru-di-dki-jakarta-resmi-naik-25-persen,Positif
05-10-2022,WJIS 2022: BI Jabar Optimistis Potensi Investasi di Jabar Pincut Investor Dunia,https://bandung.bisnis.com/read/20221005/550/1584685/wjis-2022-bi-jabar-optimistis-potensi-investasi-di-jabar-pincut-investor-dunia,Positif
15-11-2022,Indonesia Sukses Inisiasi  Terbentuknya Digital Economy Working Group,https://ekonomi.bisnis.com/read/20221115/9/1598694/indonesia-sukses-inisiasi-terbentuknya-digital-economy-working-group,Positif
23-03-2023,"Ada UU Cipta Kerja, Investasi Asing di RI Bakal Naik Drastis?",https://ekonomi.bisnis.com/read/20230323/9/1640057/ada-uu-cipta-kerja-investasi-asing-di-ri-bakal-naik-drastis,Positif
04-06-2018,"Produksi Minyak AS Sentuh Rekor, Harga Minyak Bergerak Stabil",https://market.bisnis.com/read/20180604/94/802879/produksi-minyak-as-sentuh-rekor-harga-minyak-bergerak-stabil-,Positif
10-10-2021,Pemkab Garut Dorong Pengembangan Lobster di Cikelet,https://bandung.bisnis.com/read/20211010/550/1452668/pemkab-garut-dorong-pengembangan-lobster-di-cikelet,Positif
13-04-2023,Gelontoran Investasi SWF INA untuk Kendaraan Listrik Bakal Berlanjut?,https://otomotif.bisnis.com/read/20230413/46/1646740/gelontoran-investasi-swf-ina-untuk-kendaraan-listrik-bakal-berlanjut,Positif
15-05-2018,"Isuzu Indonesia Catatkan Penjualan Ritel Giga Tumbuh 65,3%",https://otomotif.bisnis.com/read/20180515/46/795594/isuzu-indonesia-catatkan-penjualan-ritel-giga-tumbuh-653,Positif
03-04-2020,"Perkuat Modal, Bank OCBC NISP Tidak Bagikan Dividen",https://finansial.bisnis.com/read/20200403/90/1222370/perkuat-modal-bank-ocbc-nisp-tidak-bagikan-dividen-,Positif
09-09-2020,"Premi Asuransi Umum di Tujuh Sektor Ini Tetap Tumbuh Saat Pandemi, Kenapa?",https://finansial.bisnis.com/read/20200909/215/1289510/premi-asuransi-umum-di-tujuh-sektor-ini-tetap-tumbuh-saat-pandemi-kenapa,Positif
09-10-2020,Bos BCA Syariah Ungkap Potensi Pasar Pembiayaan Halal Indonesia,https://finansial.bisnis.com/read/20201009/231/1303178/bos-bca-syariah-ungkap-potensi-pasar-pembiayaan-halal-indonesia,Positif
08-01-2019,"LIBUR NATAL & TAHUN BARU 2019, Konsumsi Pertamax Tumbuh Paling Tinggi",https://ekonomi.bisnis.com/read/20190108/44/876704/libur-natal-tahun-baru-2019-konsumsi-pertamax-tumbuh-paling-tinggi,Positif
28-08-2022,Simak Saham Pilihan Samuel Sekuritas Setelah Suku Bunga BI Naik,https://market.bisnis.com/read/20220828/189/1571494/simak-saham-pilihan-samuel-sekuritas-setelah-suku-bunga-bi-naik,Positif
24-04-2020,Perpani Dukung Keputusan Pemerintah Tunda PON 2020,https://bola.bisnis.com/read/20200424/60/1232469/perpani-dukung-keputusan-pemerintah-tunda-pon-2020,Positif
04-05-2021,Pemerintah Optimis Program Inkubasi Dorong Perkembangan Startup,https://teknologi.bisnis.com/read/20210504/266/1390417/pemerintah-optimis-program-inkubasi-dorong-perkembangan-startup,Positif
01-08-2021,Bupati Anne Apresiasi Komitmen Swasta dalam Penanganan Covid-19,https://bandung.bisnis.com/read/20210801/549/1424521/bupati-anne-apresiasi-komitmen-swasta-dalam-penanganan-covid-19,Positif
18-10-2021,Akseleran Catat Pinjaman UMKM Tumbuh Dobel di Kuartal III/2021,https://finansial.bisnis.com/read/20211018/563/1455841/akseleran-catat-pinjaman-umkm-tumbuh-dobel-di-kuartal-iii2021,Positif
20-06-2023,Pengusaha Keluhkan Harga Gas Industri Naik di Atas US$6,https://ekonomi.bisnis.com/read/20230620/44/1667422/pengusaha-keluhkan-harga-gas-industri-naik-di-atas-us6,Positif
09-03-2019,ESDM Sukses Uji Coba Pembangkit 100% CPO,https://ekonomi.bisnis.com/read/20190309/44/897745/esdm-sukses-uji-coba-pembangkit-100-cpo,Positif
06-04-2021,Pemerintah Optimistis Ekonomi Tumbuh tapi Sektor Berikut Masih Lesu,https://ekonomi.bisnis.com/read/20210406/9/1377583/pemerintah-optimistis-ekonomi-tumbuh-tapi-sektor-berikut-masih-lesu,Positif
